,date,title,link,content
0,6/30/2022,"Addition of Entities, Revision and Correction of Entries, and Removal of Entities from the Entity List",https://bis.doc.gov/index.php/federal-register-notices/17-regulations/1963-federal-register-notices-2022#fr38920,"6/30/202287 FR 38920Addition of Entities, Revision and Correction of Entries, and Removal of Entities from the Entity List, effective June 28, 2022In this rule, the Bureau of Industry and Security (BIS) amends the Export Administration Regulations (EAR) by adding 36 entities under 41 entries to the Entity List. These 36 entities have been determined by the U.S. Government to be acting contrary to the national security or foreign policy interests of the United States. These entities will be listed on the Entity List under the destinations of the People’s Republic of China (China), Lithuania, Pakistan, the Russian Federation (Russia), Singapore, the United Arab Emirates (UAE), the United Kingdom, Uzbekistan, and Vietnam. Some entities are added under multiple entries, accounting for the difference in the total number of entities and entries in this rule. This rule also revises eleven existing entries under the destinations of Belarus, China, Russia, and Slovakia and corrects one existing entry on the Entity List under the destination of Pakistan. Lastly, this rule removes two entities and one address for a non-listed entity, consisting of one removal of an entity and one removal of an address under the destination of China, and one removal under the destination of Pakistan. The removals from the Entity List are made in connection with requests for removal that BIS received pursuant to the EAR and a review of the information provided in those requests.BIS Rule"
1,6/06/2022,Additions of Entities to the Entity List,https://bis.doc.gov/index.php/federal-register-notices/17-regulations/1963-federal-register-notices-2022#fr34154,"6/06/202287 FR 34154Additions of Entities to the Entity ListIn response to the Russian Federation’s (Russia’s) further invasion of Ukraine on February 24, 2022, the Department of Commerce is amending the Export Administration Regulations (EAR) by adding 71 entities under 71 entries to the Entity List. These entities have been determined by the U.S. Government to be acting contrary to the national security interests or foreign policy of the United States and will be listed on the Entity List under the destinations of Belarus and Russia.BIS Rule"
2,6/06/2022,"Export Administration Regulations: Revisions to Russia and Belarus Sanctions and Related Provisions; Other Revisions, Corrections, and Clarification",https://bis.doc.gov/index.php/federal-register-notices/17-regulations/1963-federal-register-notices-2022#fr34131,"6/06/202287 FR 34131Export Administration Regulations: Revisions to Russia and Belarus Sanctions and Related Provisions; Other Revisions, Corrections, and ClarificationBetween February and May 2022, the Bureau of Industry and Security (BIS) has published a series of amendments to the Export Administration Regulations (EAR) that have increasingly tightened export controls on the Russian Federation (Russia) and Belarus in response to Russia’s further invasion of Ukraine, as substantially enabled by Belarus. This rule revises, corrects, and clarifies certain provisions of the EAR that pertain to these controls and related provisions. First, this rule makes certain revisions to the EAR’s military end use and military end user controls as they apply to Russia and Belarus, as well as related modifications to the entries for entities on the Entity List that are Russian and Belarusian military end users. Second, it revises restrictions that apply to items destined for certain regions in Ukraine by clarifying the categories of license applications that BIS subjects to case-by-case review. Third, this rule clarifies and corrects provisions of the EAR that pertain to luxury goods destined for Russia and Belarus and items for use in Russia’s oil refinery sector. Fourth, it makes a technical correction to an EAR provision describing items and activities subject to the EAR by adding a cross-reference to the Foreign Direct Product Rules of the EAR, which were updated shortly before the Russia and Belarus export controls were imposed. Finally, with regard to export control enforcement, including enforcement of the Russia and Belarus controls, this rule revises the EAR to allow export enforcement case charging letters to be made available to the public prior to the final administrative disposition of such casesBIS Rule"
3,6/01/2022,Adoption of Congressional Notification Requirement for Certain Semiautomatic Firearms Exports Under the Export Administration Regulations (EAR),https://bis.doc.gov/index.php/federal-register-notices/17-regulations/1963-federal-register-notices-2022#fr32983,"6/01/202287 FR 32983Adoption of Congressional Notification Requirement for Certain Semiautomatic Firearms Exports Under the Export Administration Regulations (EAR), This rule is effective July 18, 2022.In this final rule, the Bureau of Industry and Security (BIS) is amending the Export Administration Regulations (EAR) to add a new section to the EAR to adopt a congressional notification requirement for certain license applications of semiautomatic firearms meeting certain value and destination requirements. This rule does not change the interagency license process for these firearms or how license applicants currently structure or generally apply for BIS licenses.BIS Rule"
4,5/26/2022,Information Security Controls: Cybersecurity Items,https://bis.doc.gov/index.php/federal-register-notices/17-regulations/1963-federal-register-notices-2022#fr31948,"5/26/202287 FR 31948Information Security Controls: Cybersecurity ItemsBIS is finalizing changes to License Exception ACE and corresponding changes in the definition section of the Export Administration Regulations (EAR) in response to public comments to an October 21, 2021 interim rule.  That rule established a new control on certain cybersecurity items for National Security (NS) and Anti-terrorism (AT) reasons, as well as adding a new License Exception Authorized Cybersecurity Exports (ACE) that authorizes exports of these items to most destinations except in certain circumstances.  These items warrant controls because these tools could be used for surveillance, espionage, or other actions that disrupt, deny or degrade the network or devices on it.  This rule also corrects Export Control Classification Number (ECCN) 5D001 in the Commerce Control List.BIS Rule"
5,5/23/2022,Commerce Control List: Controls on Certain Marine Toxins,https://bis.doc.gov/index.php/federal-register-notices/17-regulations/1963-federal-register-notices-2022#fr31195,"5/23/202287 FR 31195Commerce Control List:  Controls on Certain Marine ToxinsThis rule requests public comments on proposed amendments to the EAR that would add four marine toxins (i.e., brevetoxin, gonyautoxin, nodularin and palytoxin) to Export Control Classification Number (ECCN) 1C351 on the Commerce Control List (CCL).  BIS has identified the synthesis and collection of these toxins for evaluation according to the criteria in Section 1758 of the Export Control Reform Act of 2018 (ECRA) pertaining to emerging and foundational technologies.  In addition, this rule proposes to make conforming changes to ECCN 1C991 (Vaccines, immunotoxins, medical products, diagnostic and food testing kits), § 740.20—License Exception Strategic Trade Authorization (STA), and § 742.18—Chemical Weapons Convention (CWC) to reflect the proposed renumbering of the toxins in ECCN 1C351.d.  Although this rule does not propose to amend ECCN 1E001, if the changes proposed in this rule were to go into effect, ECCN 1E001 would control “technology” for the “development” or “production” of the four marine toxins that would be added to ECCN 1C351.BIS Rule"
6,5/11/2022,Expansion of Sanctions Against Russian Industry Sectors Under the Export Administration Regulations (EAR),https://bis.doc.gov/index.php/federal-register-notices/17-regulations/1963-federal-register-notices-2022#fr28758,"5/11/202287 FR 28758Expansion of Sanctions Against Russian Industry Sectors Under the Export Administration Regulations (EAR), effective 5/09/2022In response to the Russian Federation’s (Russia’s) ongoing aggression against Ukraine, the Department of Commerce is expanding the existing sanctions against Russian industry sectors by imposing a license requirement for exports, reexports, or transfers (in-country) to and within Russia for additional items subject to the Export Administration Regulations (EAR) identified under specific Schedule B numbers or Harmonized Tariff Schedule codes. The Bureau of Industry and Security (BIS) is taking these actions to further restrict Russia’s ability to withstand the economic impact of the multilateral sanctions, further limit sources of revenue that could support Russia’s military capabilities, and to better align with the European Union’s controls.BIS Rule"
7,4/14/2022,Expansion of Sanctions Against Russia and Belarus Under the Export Administration Regulations (EAR),https://bis.doc.gov/index.php/federal-register-notices/17-regulations/1963-federal-register-notices-2022#fr22130,"4/14/202287 FR 22130Expansion of Sanctions Against Russia and Belarus Under the Export Administration Regulations (EAR), effective 4/08/2022In response to the Russian Federation’s (Russia) ongoing aggression in Ukraine following its further invasion of the country, as substantially enabled by Belarus, this rule expands license requirements for Russia and Belarus under the Export Administration Regulations (EAR) to all items on the Commerce Control List (CCL). It also removes license exception eligibility for aircraft registered in, owned or controlled by, or under charter or lease by Belarus or a national of Belarus.BIS Rule"
8,4/12/2022,Additions to the List of Countries Excluded from Certain License Requirements under the Export Administration Regulations (EAR),https://bis.doc.gov/index.php/federal-register-notices/17-regulations/1963-federal-register-notices-2022#fr21554,"4/12/202287 FR 21554Additions to the List of Countries Excluded from Certain License Requirements under the Export Administration Regulations (EAR), effective 4/08/2022In response to the Russian Federation’s (Russia’s) further invasion of Ukraine and to protect U.S. national security and foreign policy interests, the Department of Commerce established highly restrictive license requirements and policies for certain transactions involving Russia and Belarus under the Export Administration Regulations (EAR).  To recognize partner countries implementing substantially similar export controls on Russia and Belarus, the Department of Commerce published a list of countries excluded from certain U.S. export controls related to foreign-produced items.  In this rule, the Department of Commerce adds Iceland, Liechtenstein, Norway, and Switzerland to the list of excluded countries.BIS Rule"
9,4/11/2022,Addition of Certain Entities to the Entity List; Correction,https://bis.doc.gov/index.php/federal-register-notices/17-regulations/1963-federal-register-notices-2022#fr21011,"4/11/202287 FR 21011Addition of Certain Entities to the Entity List; Correction.On February 14, 2022 (87 FR 8180), BIS published a final rule that amended the Export Administration Regulations (EAR) by revising the Entity List entry for “Huawei Cloud Brazil” (under Brazil) and adding a new entry for “Huawei Technologies Co., Ltd.” (under China, People’s Republic of).  These correcting amendments revise the “License requirement” column for each of these entities by updating the reference to the foreign direct product (FDP) provisions to read § 734.9(e), instead of § 736.2(b)(3), which was the FDP reference prior to the publication of BIS’s FDP rule on February 3, 2022 (87 FR 6022).  These amendments also correct a typographical error, in the “License requirement” column for “Huawei Technologies Co., Ltd.” (under China, People’s Republic of), by revising the phrase “except for” to read “EXCEPT2   for”, consistent with the application of Entity List footnote 2 to this entity.BIS Rule"
10,4/07/2022,Additions of Entities to the Entity List,https://bis.doc.gov/index.php/federal-register-notices/17-regulations/1963-federal-register-notices-2022#fr20295,"4/07/202287 FR 20295Additions of Entities to the Entity List, effective April 01, 2022In response to the Russian Federation’s (Russia’s) further invasion of Ukraine on February 24, 2022, the Department of Commerce is amending the Export Administration Regulations (EAR) by adding 120 entities under 120 entries to the Entity List. These 120 entities have been determined by the U.S. Government to be acting contrary to the national security interests or foreign policy of the United States and will be listed on the Entity List under the destinations of Belarus and Russia.BIS Rule"
11,3/16/2022,Imposition of Sanctions on ‘Luxury Goods’ Destined for Russia and Belarus and for Russian and Belarusian Oligarchs and Malign Actors Under the Export Administration Regulations (EAR),https://bis.doc.gov/index.php/federal-register-notices/17-regulations/1963-federal-register-notices-2022#fr14785,"3/16/202287 FR 14785Imposition of Sanctions on ‘Luxury Goods’ Destined for Russia and Belarus and for Russian and Belarusian Oligarchs and Malign Actors Under the Export Administration Regulations (EAR), effective March 11, 2022In response to the Russian Federation’s (Russia’s) further invasion of Ukraine, and Belarus’s substantial enabling of Russia’s invasion, the Department of Commerce is imposing restrictions on the export, reexport, or transfer (in-country) to or within Russia or Belarus of ‘luxury goods’ under the Export Administration Regulations (EAR) and for exports, reexports and transfers (in-country) worldwide to certain Russian or Belarusian oligarchs and other malign actors supporting the Russian or Belarusian governments.  Taken together, these new export controls will significantly limit financially elite individuals’ and organizations’ access to luxury goods and thereby accentuate the consequences of providing such support.BIS Rule"
12,3/10/2022,Addition to the List of Countries Excluded from Certain License Requirements under the Export Administration Regulations (EAR),https://bis.doc.gov/index.php/federal-register-notices/17-regulations/1963-federal-register-notices-2022#fr13627,"3/10/2022
87 FR 13627Addition to the List of Countries Excluded from Certain License Requirements under the Export Administration Regulations (EAR), effective March 4, 2022In response to the Russian Federation’s (Russia’s) further invasion of Ukraine, and to protect   U.S. national security and foreign policy interests, the Department of Commerce has added new and highly restrictive license requirements and policies for certain transactions involving Russia and Belarus under the Export Administration Regulations (EAR).  In order to recognize partner countries that have committed to implementing substantially similar new export controls on Russia and Belarus in their domestic laws, the Department of Commerce has published a list of countries excluded from portions of these new U.S. export controls.  These exclusions apply specifically to certain requirements under the EAR related to foreign-produced items.  In this rule, the Department of Commerce adds the Republic of Korea (South Korea) to the list of excluded countries.BIS Rule"
13,3/09/2022,Further Imposition of Sanctions Against Russia with the Addition of Certain Entities to the Entity List,https://bis.doc.gov/index.php/federal-register-notices/17-regulations/1963-federal-register-notices-2022#fr13141,"3/9/2022
87 FR 13141Further Imposition of Sanctions Against Russia with the Addition of Certain Entities to the Entity List, effective March 3, 2022In response to the Russian Federation’s (Russia’s) further invasion of Ukraine on February 24, 2022, the Department of Commerce is amending the Export Administration Regulations (EAR) by adding 91 new entities to the Entity List under the destinations of Belize, Estonia, Kazakhstan, Latvia, Malta, Russia, Singapore, Slovakia, Spain, and United Kingdom with this final rule. These 91 entities have been determined by the U.S. Government to be acting contrary to the foreign policy or national security interests of the United States.BIS notes that this rule is meant to serve as a response to Russian aggression against Ukraine. This rule does include entities in several allied countries, including member of the European Union and North Atlantic Treaty Organization, but is not an action against the countries in which the entities are located or registered or the governments of those countries. This rule only serves as an action against those entities listed, which have assisted the Russian military, contrary to U.S. foreign and national security policy interests.BIS Rule"
14,3/08/2022,Expansion of Sanctions Against the Russian Industry Sector Under the Export Administration Regulations (EAR),https://bis.doc.gov/index.php/federal-register-notices/17-regulations/1963-federal-register-notices-2022#fr12856,"3/8/202287 FR 12856Expansion of Sanctions Against the Russian Industry Sector Under the Export Administration Regulations (EAR), effective March 3, 2022In response to the Russian Federation’s (Russia’s) further invasion of Ukraine, the Department of Commerce is expanding the existing sanctions against the Russian industry sector by adding a new prohibition under the Export Administration Regulations (EAR) that targets the oil refinery sector in Russia. These new export controls will further limit revenue that could support the military capabilities of Russia.BIS Rule"
15,3/08/2022,Imposition of Sanctions Against Belarus Under the Export Administration Regulations (EAR),https://bis.doc.gov/index.php/federal-register-notices/17-regulations/1963-federal-register-notices-2022#fr13048,"3/8/202287 FR 13048Imposition of Sanctions Against Belarus Under the Export Administration Regulations (EAR), effective March 2, 2022In response to Belarus’s substantial enabling of the Russian Federation’s (Russia)’s further invasion of Ukraine, this rule is adding new license requirements and review policies for Belarus to the Export Administration Regulations (EAR) to render Belarus subject to the same sanctions that were imposed on Russia under the EAR effective February 24, 2022.  These new sanctions impose new Commerce Control List (CCL)-based license requirements for Belarus; revise the two foreign “direct product” rules (FDP rules) that are specific to Russia and Russian ‘military end users’ to make them  also applicable to Belarus and Belarusian ‘military end users;’ specify a license review policy of denial applicable to all of the license requirements on Belarus that are being added in this rule, with certain limited exceptions; significantly restrict the use of EAR license exceptions; expand the existing ‘military end use’ and ‘military end user’ control scope to include Belarus for all items “subject to the EAR” other than food and medicine designated EAR99; and add two new Belarusian entities to the Entity List as ‘military end users.’  This rule also imposes a license requirement for nuclear nonproliferation items for exports and reexports to Belarus and removes Belarus from Country Group A:4 under the EAR.  In addition, for Belarus and Russia, this rule amends the availability of License Exceptions AVS and ENC and includes clarifying guidance on the availability of CCD.BIS Rule"
16,3/03/2022,Implementation of Sanctions Against Russia Under the Export Administration Regulations (EAR),https://bis.doc.gov/index.php/federal-register-notices/17-regulations/1963-federal-register-notices-2022#fr12226,"2/24/202287 FR 12226Implementation of Sanctions Against Russia Under the Export Administration Regulations (EAR), effective February 24, 2022In response to the Russian Federation’s (Russia’s) further invasion of Ukraine, with this final rule, the Department of Commerce is adding new Russia license requirements and licensing policies to the Export Administration Regulations (EAR) to protect U.S. national security and foreign policy interests.  These new Russia measures: impose new Commerce Control List (CCL)-based license requirements for Russia; add two new foreign “direct product” rules (FDP rules) specific to Russia and Russian ‘military end users;’ specify a license review policy of denial applicable to all of the license requirements being added in this rule, with certain limited exceptions; significantly restrict the use of EAR license exceptions; expand the existing Russia ‘military end use’ and ‘military end user’ control scope to all items “subject to the EAR” other than food and medicine designated EAR99, or ECCN 5A992.c and 5D992.c unless for Russian “government end users” and Russian state-owned enterprises (SoEs); transfer forty-five Russian entities from the Military End-User (MEU) List to the Entity List with an expanded license requirement of all items subject to the EAR (including foreign-produced items subject to the Russia-MEU FDP rules); and add two new Russia entities and revise two Russia entities to the Entity List.  Lastly, this rule imposes comprehensive export, reexport and transfer (in-country) restrictions for the so-called Donetsk People’s Republic (DNR) and Luhansk People’s Republics (LNR) regions of Ukraine (“Covered Regions   of Ukraine”) and makes conforming revisions to export, reexport transfer (in-country) restrictions for Crimea Region of Ukraine provisions.BIS Rule"
17,2/14/2022,Addition of Certain Entities to the Entity List,https://bis.doc.gov/index.php/federal-register-notices/17-regulations/1963-federal-register-notices-2022#fr8180,"2/14/202287 FR 8180RIN 0694-AI70Addition of Certain Entities to the Entity ListThis final rule amends the Export Administration Regulations (EAR) by adding seven entities under seven entries to the Entity List. These seven entities have been determined by the U.S. Government to be acting contrary to the foreign policy or national security interests of the United States and will be listed on the Entity List under the destinations of the People’s Republic of China (China), Pakistan, and the United Arab Emirates (UAE). This final rule also modifies four existing entries on the Entity List under the destination of China.BIS Rule"
18,2/10/2022,Request for Public Comments on the Section 232 Exclusions Process,https://bis.doc.gov/index.php/federal-register-notices/17-regulations/1963-federal-register-notices-2022#fr7777,"2/10/202287 FR 7777Request for Public Comments on the Section 232 Exclusions ProcessThe Bureau of Industry and Security (BIS) is seeking public comments regarding the Section 232 Exclusions Process. A Presidential Proclamation (Adjusting Imports of Steel into the United States), published on January 3, 2022, directed the Secretary of Commerce to seek public comment on the Section 232 Exclusions Process, including its responsiveness to market demand and enhanced consultation with U.S. firms and labor organizations.BIS Rule"
19,2/08/2022,Revisions to the Unverified List ,https://bis.doc.gov/index.php/federal-register-notices/17-regulations/1963-federal-register-notices-2022#fr7037,Revisions to the Unverified List2/08/202287 FR 7037RIN 0694-AI69The Bureau of Industry and Security (BIS) is amending the Export Administration Regulations by adding thirty-three (33) persons to the Unverified List (UVL).  The thirty-three persons are added to the UVL on the basis that BIS was unable to verify their bona fides because an end-use check could not be completed satisfactorily for reasons outside the U.S. Government’s control. All thirty-three persons added to the UVL in this rule are listed under China.BIS Rule
20,2/03/2022,"Foreign-Direct Product Rules: Organization, Clarification, and Correction ",https://bis.doc.gov/index.php/federal-register-notices/17-regulations/1963-federal-register-notices-2022#fr6022,"2/03/202287 FR 6022Foreign-Direct Product Rules: Organization, Clarification, and CorrectionThis final rule clarifies, reorganizes, and makes minor corrections to the provisions of the foreign-direct product (FDP) rules.  Before this final rule, the FDP rules appeared in parts 736 and 744 of the Export Administration Regulations (EAR); now, the rules are consolidated in part 734 of the EAR.  These revisions clarify the applicability of the FDP rules and make one correction applicable to the FDP rules as to the term “U.S.-origin technology and software.”BIS Rule"
